{
  "id": "2b8e4f10-7d3c-4a95-8e6b-51c0d9f2a7e3",
  "proposal": {
    "concept": {
      "stereo": "phase",
      "name": "LargeOrder",
      "label": {
        "en": "Large order",
        "cs": "Velká objednávka"
      },
      "of": "cn.Order",
      "definition_text": "order_value > 1000"
    }
  },
  "provenance": {
    "producer": "au:synthesizer",
    "source_ref": "recipe://hartland.orders/order-review#s2",
    "confidence": {
      "value": 0.64,
      "producer": "au:synthesizer",
      "method": "unbound-mention"
    },
    "evidence": {
      "examples": [
        {
          "kind": "recipe_sentence",
          "ref": "recipe://hartland.orders/order-review#s2",
          "text": "Large orders, over 1000, wait for a manual review before they are released."
        }
      ]
    },
    "created_at": "2026-10-23T09:20:31Z"
  },
  "status": "promoted",
  "resolution": {
    "by": "a.steward",
    "at": "2026-10-24T08:00:00Z",
    "canon_ref": "4f2a9c1:cn.LargeOrder",
    "note": "threshold confirmed by sales ops"
  }
}
