{
  "id": "2b8e4f10-7d3c-4a95-8e6b-51c0d9f2a7e3",
  "proposal": {
    "concept": {
      "stereo": "quality",
      "name": "weight",
      "of": "cn.Item",
      "suggested_grounding": "er.entity.item.weight"
    }
  },
  "provenance": {
    "producer": "au:synthesizer",
    "source_ref": "recipe://hartland.orders/order-review#s2",
    "confidence": {
      "value": 0.64,
      "producer": "au:synthesizer",
      "method": "unbound-mention"
    },
    "evidence": {
      "examples": [
        {
          "kind": "recipe_sentence",
          "ref": "recipe://hartland.orders/order-review#s2",
          "text": "Large orders, over 1000, wait for a manual review before they are released."
        }
      ]
    },
    "created_at": "2026-10-23T09:20:31Z"
  },
  "status": "proposed"
}
